{
  "provider": "xai",
  "model_name": "grok-4-0709",

  "modalities": {
    "input": ["text"],
    "output": ["text"]
  },

  "capabilities": [
    "function_calling",
    "structured_outputs",
    "reasoning"
  ],

  "endpoints": [
    "chat_completions",
    "responses"
  ],

  "tools": [
    "livesearch"
  ],

  "snapshots": [
    "grok-4-0709",
    "grok-4",
    "grok-4-latest"
  ],

  "training_data_cutoff": null,
  "context_window": 256000,
  "max_output_tokens": null,
  "reasoning": true,

  "rate_limits": {
    "tiers": {
      "free":   { "rpm": null, "tpm": null, "batch_queue_limit": null },
      "tier_1": { "rpm": null, "tpm": null, "batch_queue_limit": null },
      "tier_2": { "rpm": null, "tpm": null, "batch_queue_limit": null },
      "tier_3": { "rpm": null, "tpm": null, "batch_queue_limit": null },
      "tier_4": { "rpm": null, "tpm": null, "batch_queue_limit": null },
      "tier_5": { "rpm": null, "tpm": null, "batch_queue_limit": null }
    },
    "generic_limits": { "rpm": 480, "tpm": 2000000 }
  },

  "pricing": {
    "text_per_MTok": {
      "batch":    { "input": null, "cached_input": null, "output": null },
      "flex":     { "input": null, "cached_input": null, "output": null },
      "standard": { "input": 3.00, "cached_input": 0.75, "output": 15.00 },
      "priority": { "input": null, "cached_input": null, "output": null },
      "base": {
        "input": null,
        "cache_writes_5m": null,
        "cache_writes_1h": null,
        "cache_hits_refreshes": null,
        "output": null
      }
    },

    "image_per_MTok": { "input": null, "cached_input": null, "output": null },
    "audio_per_MTok": { "input": null, "cached_input": null, "output": null },

    "fine_tuning_per_MTok": {
      "batch":    { "training": null, "input": null, "cached_input": null, "output": null },
      "standard": { "training": null, "input": null, "cached_input": null, "output": null }
    },

    "embeddings_per_MTok": { "cost": null, "batch_cost": null },

    "legacy_models_per_MTok": {
      "batch":    { "input": null, "output": null },
      "standard": { "input": null, "output": null }
    },

    "per_image": null,

    "feature_specific": {
      "batch_processing": { "input": null, "output": null },
      "long_context": {
        "<=200k_input": null,
        "<=200k_output": null,
        ">200k_input": null,
        ">200k_output": null
      },
      "tool_use": { "auto_none": null, "any_tool": null }
    },

    "tools": {
      "code_interpreter": null,
      "file_search_storage": null,
      "file_search_call": null,
      "web_search": null,
      "web_search_preview": null,
      "mcp_connector": null,
      "bash": null,
      "code_execution": null,
      "computer_use": null,
      "text_editor": null,
      "web_fetch": null,
      "livesearch": 25.00
    }
  },

  "last_updated": "2025-09-15"
}
