{
  "provider": "openai",
  "model_name": "gpt-5",

  "modalities": {
    "input": ["text", "image"],
    "output": ["text"]
  },

  "capabilities": ["streaming", "function_calling", "structured_outputs", "distillation", "reasoning"],
  "endpoints": [
    "chat_completions",
    "responses",
    "batch"
  ],
  "tools": ["web_search", "file_search", "image_generation", "code_interpreter", "mcp"],
  "snapshots": ["gpt-5-2025-08-07"],

  "training_data_cutoff": "2024-09-30",
  "context_window": 400000,
  "max_output_tokens": 128000,
  "reasoning": true,

  "rate_limits": {
    "tiers": {
      "free": { "rpm": null, "tpm": null, "batch_queue_limit": null },
      "tier_1": { "rpm": 500, "tpm": 30000, "batch_queue_limit": 90000 },
      "tier_2": { "rpm": 5000, "tpm": 450000, "batch_queue_limit": 1350000 },
      "tier_3": { "rpm": 5000, "tpm": 800000, "batch_queue_limit": 100000000 },
      "tier_4": { "rpm": 10000, "tpm": 2000000, "batch_queue_limit": 200000000 },
      "tier_5": { "rpm": 15000, "tpm": 40000000, "batch_queue_limit": 15000000000 }
    },
    "generic_limits": { "rpm": null, "tpm": null }
  },

  "pricing": {
    "text_per_MTok": {
      "batch": { "input": 0.625, "cached_input": 0.0625, "output": 5.0 },
      "flex": { "input": 0.625, "cached_input": 0.0625, "output": 5.0 },
      "standard": { "input": 1.25, "cached_input": 0.125, "output": 10.0 },
      "priority": { "input": 2.5, "cached_input": 0.25, "output": 25.0 },
      "base": {
        "input": null,
        "cached_input": null,
        "output": null,
        "cache_writes_5m": null,
        "cache_writes_1h": null,
        "cache_hits_refreshes": null
      }
    },

    "image_per_MTok": { "input": null, "cached_input": null, "output": null },
    "audio_per_MTok": { "input": null, "cached_input": null, "output": null },

    "fine_tuning_per_MTok": {
      "batch": { "training": null, "input": null, "cached_input": null, "output": null },
      "standard": { "training": null, "input": null, "cached_input": null, "output": null }
    },

    "embeddings_per_MTok": { "cost": null, "batch_cost": null },

    "legacy_models_per_MTok": {
      "batch": { "input": null, "output": null },
      "standard": { "input": null, "output": null }
    },

    "per_image": null,

    "feature_specific": {
      "batch_processing": { "input": null, "output": null },
      "long_context": {
        "<=200k_input": null,
        "<=200k_output": null,
        ">200k_input": null,
        ">200k_output": null
      },
      "tool_use": { "auto_none": null, "any_tool": null }
    },

    "tools": {
      "code_interpreter": 0.03,
      "file_search_storage": 0.10,
      "file_search_call": 2.50,
      "web_search": 10.0,
      "web_search_preview": 10.0,
      "mcp_connector": null,
      "bash": null,
      "code_execution": null,
      "computer_use": null,
      "text_editor": null,
      "web_fetch": null,
      "livesearch": null
    }
  },

  "last_updated": "2025-09-13T12:00:00Z"
}
