{
  "provider": "openai",
  "model_name": "gpt-4.1-mini",

  "modalities": {
    "input": ["text", "image"],
    "output": ["text"]
  },

  "capabilities": [
    "streaming",
    "structured_outputs",
    "function_calling",
    "fine_tuning",
    "predicted_outputs"
  ],

  "endpoints": [
    "chat_completions",
    "responses",
    "assistants",
    "batch",
    "fine_tuning"
  ],

  "tools": [],

  "snapshots": [
    "gpt-4.1-mini",
    "gpt-4.1-mini-2025-04-14"
  ],

  "training_data_cutoff": "2024-06-01",
  "context_window": 1048576,
  "max_output_tokens": 32768,
  "reasoning": false,

  "rate_limits": {
    "tiers": {
      "free":   { "rpm": 3,     "tpm": 40000,     "batch_queue_limit": null },
      "tier_1": { "rpm": null,  "tpm": null,      "batch_queue_limit": null },
      "tier_2": { "rpm": 5000,  "tpm": 2000000,   "batch_queue_limit": 20000000 },
      "tier_3": { "rpm": 5000,  "tpm": 4000000,   "batch_queue_limit": 40000000 },
      "tier_4": { "rpm": 10000, "tpm": 10000000,  "batch_queue_limit": 1000000000 },
      "tier_5": { "rpm": 30000, "tpm": 150000000, "batch_queue_limit": 15000000000 }
    },
    "generic_limits": { "rpm": null, "tpm": null }
  },

  "pricing": {
    "text_per_MTok": {
      "batch":    { "input": 0.20, "cached_input": null,  "output": 0.80 },
      "flex":     { "input": null, "cached_input": null,  "output": null },
      "standard": { "input": 0.40, "cached_input": 0.10,  "output": 1.60 },
      "priority": { "input": 0.70, "cached_input": 0.175, "output": 2.80 },
      "base": {
        "input": null,
        "cache_writes_5m": null,
        "cache_writes_1h": null,
        "cache_hits_refreshes": null,
        "output": null
      }
    },

    "image_per_MTok": { "input": null, "cached_input": null, "output": null },
    "audio_per_MTok": { "input": null, "cached_input": null, "output": null },

    "fine_tuning_per_MTok": {
      "batch":    { "training": 5.00, "input": 0.40, "cached_input": 0.10, "output": 1.60 },
      "standard": { "training": 5.00, "input": 0.80, "cached_input": 0.20, "output": 3.20 }
    },

    "embeddings_per_MTok": { "cost": null, "batch_cost": null },

    "legacy_models_per_MTok": {
      "batch":    { "input": null, "output": null },
      "standard": { "input": null, "output": null }
    },

    "per_image": null,

    "feature_specific": {
      "batch_processing": { "input": null, "output": null },
      "long_context": {
        "<=200k_input": null,
        "<=200k_output": null,
        ">200k_input": null,
        ">200k_output": null
      },
      "tool_use": { "auto_none": null, "any_tool": null }
    },

    "tools": {
      "code_interpreter": 0.03,
      "file_search_storage": 0.10,
      "file_search_call": 2.50,
      "web_search": 10.00,
      "web_search_preview": 25.00,
      "mcp_connector": null,
      "bash": null,
      "code_execution": null,
      "computer_use": null,
      "text_editor": null,
      "web_fetch": null,
      "livesearch": null
    }
  },

  "last_updated": "2025-09-15"
}
